J'ai une fuite d'eau chez moi,0
J'ai une fuite de gaz,0
Grosse innondation dans ma cuisine,0
ça sent le gaz dans mon appartement,0
J'ai plus du tout d'éléctricité,0
J'ai plus de chauffage,0
SOS Homeserve,0
Au secours Homeserve,0
Il me faut absolument un réparateur,0
Il me faut un éléctricien tout de suite,0
J'ai besoin de toute urgence d'un plombier,0
J'ai besoin d'un professionnel de toute urgence,0
J'ai besoin d'un professionnel pour déboucher des canalisations,0
La fuite est visible et non encastrée,0
J'ai un sinistre chez moi,0
J'ai besoin tout de suite d'un professionnel,0
J'ai une urgence en plomberie,0
Grosse fuite de gaz,0
J'ai un gros problème d'eau,0
J'ai ma baignoire qui fuit,0
Mon évier est bouché,0
J'ai de l'eau partout le sol,0
J'ai une canalisation qui a pétée,0
J'ai plusieurs canalisations bouchées,0
J'ai une fuite d'eau à l'exterieur,0
Il me faut un débouchage de canalisation,0
J'ai une fuite sur une canalisation apparente d'alimentation d'eau,0
Il y a une fuite visible sur une canalisation,0
Il y a une fuite sur un robinet,0
Mon robinet fuit ?,0
J'ai des câbles d’alimentation à changr,1
J'ai les toilettes bouchées,1
J'ai une chasse d'eau bouchée,1
J'ai un joint d'étanchéité à changer,1
J'ai un siphon à déboucher,1
Je veux rénover votre ancien robinet,1
Mon robinet de baignoire fuit fonctionne plus correctement ?,1
J'ai un robinet cassé,1
J'ai un interrupteur en panne,1
J'ai une ampoule qui a grillée,1
Faire un devis pour déboucher des canalisations,1
J'ai un flexible de gaz à changer,1
J'ai besoin d'un devis de réparation,1
J'ai un joint d'étanchéité a changer,1
J'ai un trop-pleins d'évier,1
J'ai besoin de conseils sur le diagnostic de fuite d'eau,2
J'aurais besoin de conseils sur ma consommation en eau,2
Besoin d'un diagnostic sur ma plomberie,2
Combien coûte une installation de robinet ?,2
Combien coûte un ballon de chauffage à remplacer ?,2
Besoin d'un avis sur mon éléctricité,2
J'ai besoin d'un diagnostic sur mon éléctricité,2
Comment éviter la surconsommation d'eau ?,2
Comment éviter un dégât des eaux ?,2
Comment réparer une fuite d'eau ?,2 
Trouver un artisan rapidement,2
Je cherche des artisans professionnels,2
Choisir ses horaires d'intervention,2
Je veux un service rapide efficace et professionnel, 2
Je cherche un intervenant sérieux,2
Je cherche un professionnel compétent,2